{"authoritySeriesId":"curation-program-acceptance-authority-v2","authorizationBoundary":{"assessmentTransitionAuthorized":false,"liveMigrationAuthorized":false,"productionActivationAuthorized":false,"rehearsalAuthorized":true},"claimBoundary":{"provesBehavior":false,"provesCrossHostPortability":false,"provesOverallHarnessCompletion":false,"provesProductionReadiness":false,"provesReleaseEligibility":false,"provesValue":false},"delta":{"assessmentsChanged":[],"criterionEvidenceLinksAdded":[],"criterionEvidenceLinksRemoved":[],"evidenceAdded":[],"evidenceRemoved":[],"selectorTargetGeneration":1},"executionCounters":{"accountConnectionCount":0,"candidateExecutionCount":0,"consumerMutationCount":0,"enableCount":0,"installCount":0,"managerMutationCount":0,"modelRequestCount":0,"pluginExecutionCount":0,"productionActivationCount":0,"publicationCount":0,"releaseCount":0},"fromProgramPlanBinding":{"authoritySchema":2,"generation":1,"id":"curation-program-plan-v2","path":"curation-program-plan-v2.json","sha256":"00094a975f036639e55ef54a21d34ea704393ed302f31da858b7a140b21d1d12"},"fromSnapshotBinding":{"authoritySchema":2,"generation":2,"id":"curation-program-acceptance-authority-v2-g000002","path":"snapshots/v2/g000002.json","sha256":"046a8346e18f7a6bc79b95103dd33078c34c40e2bdda17dab260c0bb6f4ac156"},"id":"curation-program-acceptance-authority-v2-g000002-to-g000001-rollback","invariants":{"acceptanceInventory":{"partial":15,"planned":0,"verified":46},"authoritySeriesPreserved":true,"generationStepValid":true,"immutableHistoryPreserved":true,"programPlanBindingsValid":true},"schema":1,"toProgramPlanBinding":{"authoritySchema":2,"generation":1,"id":"curation-program-plan-v2","path":"curation-program-plan-v2.json","sha256":"00094a975f036639e55ef54a21d34ea704393ed302f31da858b7a140b21d1d12"},"toSnapshotBinding":{"authoritySchema":2,"generation":1,"id":"curation-program-acceptance-authority-v2-g000001","path":"snapshots/v2/g000001.json","sha256":"613ba54b4d944ebe1a497fcf22fc22e32528e2a0fcbd935b7d304c1bd34dcde1"},"transactionType":"rollback"}
